candidate_id,description,rationale,registered_at,eligible_after_market_end_time,min_confidence,min_edge,stake_usd,max_fill_delay_seconds,filter_kind,min_abs_return_1m,min_abs_return_5m,max_abs_return_5m,min_abs_distance_to_barrier_bps,max_abs_distance_to_barrier_bps,status
avoid_low_momentum_near_barrier,Avoid low momentum near barrier,Holdout diagnostics showed weak performance when one-minute momentum is low and price sits near barrier,2026-05-18T15:26:40.924565+00:00,2026-05-18T15:20:00+00:00,0.65,0.03,10.0,30,avoid_low_momentum_near_barrier,0.0002,,,1.5,,registered
avoid_mid_abs_return_5m,Avoid mid 5m absolute return,Low information audit showed mid absolute 5m return removal improved holdout accuracy while keeping roughly 72 percent coverage,2026-05-18T15:38:24.074837+00:00,2026-05-18T15:30:00+00:00,0.65,0.03,10.0,30,avoid_mid_abs_return_5m,,0.000274801436789707,0.000750660468105679,,,registered
avoid_mid_distance_to_barrier_2_6bps,Avoid 2 to 6 bps barrier distance,Recent forward loss diagnostics showed the 2 to 6 bps distance-to-barrier slice carried negative recent PnL; prospective evidence only.,2026-05-19T07:40:47.644109+00:00,2026-05-19T07:30:00+00:00,0.65,0.03,10.0,30,avoid_mid_distance_to_barrier_bps,,,,2.0,6.0,registered
confidence_070,Raise confidence gate to 0.70,Recent forward loss diagnostics showed the 0.65 to 0.70 confidence bucket had 0 wins across 5 recent trades and -52.17 USDC paper PnL; prospective evidence only.,2026-05-19T06:00:07.619632+00:00,2026-05-19T05:45:00+00:00,0.7,0.03,10.0,30,none,,,,,,registered
edge_008,Higher edge gate,Offline execution proxy suggested stronger price discipline deserves a prospective test,2026-05-18T15:12:38.519494+00:00,2026-05-18T15:05:00+00:00,0.65,0.08,10.0,30,none,,,,,,registered
